category,concept,sensekey,article,singular,plural,generic,taxonomic-question,taxonomic-declarative
clothing,armor,armor%1:06:00::,an armor,armor,armors,s,Is an armor a type of,an armor is a type of
clothing,earmuffs,earmuff%1:06:00::,earmuffs,earmuff,earmuffs,p,Are earmuffs a type of,earmuffs are a type of
container,ashtray,ashtray%1:06:00::,an ashtray,ashtray,ashtrays,p,Are ashtrays a type of,ashtrays are a type of
fish,eel,eel%1:05:00::,an eel,eel,eels,s,Is an eel a type of,an eel is a type of
flower,orchid,orchid%1:20:00::,an orchid,orchid,orchids,s,Is an orchid a type of,an orchid is a type of
food,ice_cream,ice_cream%1:13:00::,ice cream,ice cream,ice creams,s,Is ice cream a type of,ice cream is a type of
fruit,apple,apple%1:13:00::,an apple,apple,apples,s,Is an apple a type of,an apple is a type of
fruit,apricot,apricot%1:13:00::,an apricot,apricot,apricots,s,Is an apricot a type of,an apricot is a type of
fruit,orange,orange%1:13:00::,an orange,orange,oranges,s,Is an orange a type of,an orange is a type of
furniture,armchair,armchair%1:06:00::,an armchair,armchair,armchairs,s,Is an armchair a type of,an armchair is a type of
invertebrate,ant,ant%1:05:00::,an ant,ant,ants,s,Is an ant a type of,an ant is a type of
music,accordion,accordion%1:06:00::,an accordion,accordion,accordions,s,Is an accordion a type of,an accordion is a type of
music,organ,organ%1:06:00::,an organ,organ,organs,s,Is an organ a type of,an organ is a type of
reading,encyclopaedia,encyclopedia%1:10:00::,an encyclopaedia,encyclopaedia,encyclopaedias,s,Is an encyclopaedia a type of,an encyclopaedia is a type of
sea creature,octopus,octopus%1:05:00::,an octopus,octopus,octopuses,s,Is an octopus a type of,an octopus is a type of
sea creature,oyster,oyster%1:05:00::,an oyster,oyster,oysters,s,Is an oyster a type of,an oyster is a type of
tool,axe,axe%1:06:00::,an axe,axe,axes,s,Is an axe a type of,an axe is a type of
tree,elm,elm%1:20:00::,an elm tree,elm tree,elm trees,s,Is an elm tree a type of,an elm tree is a type of
tree,eucalyptus,eucalyptus%1:20:00::,a eucalyptus tree,eucalyptus tree,eucalyptus trees,s,Is a eucalyptus tree a type of,a eucalyptus tree is a type of
tree,oak,oak%1:20:00::,an oak tree,oak tree,oak trees,s,Is an oak tree a type of,an oak tree is a type of
vegetable,artichoke,artichoke%1:13:00::,an artichoke,artichoke,artichokes,s,Is an artichoke a type of,an artichoke is a type of
vegetable,asparagus,asparagus%1:13:00::,an asparagus,asparagus,asparagus,s,Is an asparagus a type of,an asparagus is a type of
vegetable,avocado,avocado%1:13:00::,an avocado,avocado,avocados,s,Is an avocado a type of,an avocado is a type of
vegetable,eggplant,eggplant%1:13:00::,an eggplant,eggplant,eggplants,s,Is an eggplant a type of,an eggplant is a type of
vegetable,olive,olive%1:13:00::,an olive,olive,olives,s,Is an olive a type of,an olive is a type of
vegetable,onion,onion%1:13:00::,an onion,onion,onions,s,Is an onion a type of,an onion is a type of
vehicle,airplane,airplane%1:06:00::,an airplane,airplane,airplanes,s,Is an airplane a type of,an airplane is a type of
vehicle,ambulance,ambulance%1:06:00::,an ambulance,ambulance,ambulances,s,Is an ambulance a type of,an ambulance is a type of
vehicle,unicycle,unicycle%1:06:00::,a unicycle,unicycle,unicycles,s,Is a unicycle a type of,a unicycle is a type of
water vehicle,oil_tanker,oil_tanker%1:06:00::,an oil tanker,oil tanker,oil tankers,s,Is an oil tanker a type of,an oil tanker is a type of
weapon,arrow,arrow%1:06:00::,an arrow,arrow,arrows,s,Is an arrow a type of,an arrow is a type of
appliance,refrigerator,fridge%1:06:00::,a refrigerator,refrigerator,refrigerators,s,Is a refrigerator a type of,a refrigerator is a type of